{
  "case_id": "web_red_wine_quality_cortez__891a10",
  "system": "agent",
  "model_id": "claude-opus-5",
  "claims": [
    {
      "quoted_span": "The two datasets are related to red and white variants of the Portuguese \"Vinho Verde\" wine.",
      "span_start": 13,
      "span_end": 105,
      "verdict": "unverifiable",
      "reason": "prose"
    },
    {
      "quoted_span": "For more details, consult the reference [Cortez et al., 2009].",
      "span_start": 106,
      "span_end": 168,
      "verdict": "unverifiable",
      "reason": "prose"
    },
    {
      "quoted_span": "Due to privacy and logistic issues, only physicochemical (inputs) and sensory (the output) variables are available",
      "span_start": 169,
      "span_end": 283,
      "verdict": "unverifiable",
      "reason": "prose"
    },
    {
      "quoted_span": "there is no data about grape types, wine brand, wine selling price, etc.",
      "span_start": 290,
      "span_end": 362,
      "verdict": "unverifiable",
      "reason": "prose"
    },
    {
      "quoted_span": "These datasets can be viewed as classification or regression tasks.",
      "span_start": 367,
      "span_end": 434,
      "verdict": "unverifiable",
      "reason": "prose"
    },
    {
      "quoted_span": "The classes are ordered and not balanced (e.g. there are much more normal wines than excellent or poor ones).",
      "span_start": 435,
      "span_end": 544,
      "verdict": "unverifiable",
      "reason": "prose"
    },
    {
      "quoted_span": "This dataset is also available from the UCI machine learning repository, https://archive.ics.uci.edu/ml/datasets/wine+quality , I just shared it to kaggle for convenience.",
      "span_start": 552,
      "span_end": 723,
      "verdict": "unverifiable",
      "reason": "prose"
    },
    {
      "quoted_span": "Input variables (based on physicochemical tests):",
      "span_start": 906,
      "span_end": 955,
      "verdict": "unverifiable",
      "reason": "prose"
    },
    {
      "quoted_span": "1 - fixed acidity",
      "span_start": 960,
      "span_end": 977,
      "verdict": "holds",
      "claimed": "1 - fixed acidity",
      "computed": "column 'fixed acidity' present at position 1 (1-indexed), dtype=float64, non-numeric cells=0"
    },
    {
      "quoted_span": "2 - volatile acidity",
      "span_start": 983,
      "span_end": 1003,
      "verdict": "holds",
      "claimed": "2 - volatile acidity",
      "computed": "column 'volatile acidity' present at position 2 (1-indexed) of 12; dtype=float64; non-numeric cells=0; min=0.12, max=1.58"
    },
    {
      "quoted_span": "3 - citric acid",
      "span_start": 1009,
      "span_end": 1024,
      "verdict": "holds",
      "claimed": "3 - citric acid",
      "computed": "'citric acid' at 1-based position 3 of 12 columns (dtype=float64)"
    },
    {
      "quoted_span": "4 - residual sugar",
      "span_start": 1030,
      "span_end": 1048,
      "verdict": "holds",
      "claimed": "4 - residual sugar",
      "computed": "column 'residual sugar' at position 4 of 12; dtype=float64; non-numeric non-null values=0"
    },
    {
      "quoted_span": "5 - chlorides",
      "span_start": 1054,
      "span_end": 1067,
      "verdict": "holds",
      "claimed": "5 - chlorides",
      "computed": "'chlorides' is attribute #5 of 12; 5th column is 'chlorides'; numeric=True, non-numeric values=0"
    },
    {
      "quoted_span": "6 - free sulfur dioxide",
      "span_start": 1073,
      "span_end": 1096,
      "verdict": "holds",
      "claimed": "6 - free sulfur dioxide",
      "computed": "column 'free sulfur dioxide' at 1-based position 6 (claim says 6); dtype=float64; numeric-parseable non-null 1599/1599 rows"
    },
    {
      "quoted_span": "7 - total sulfur dioxide",
      "span_start": 1103,
      "span_end": 1127,
      "verdict": "holds",
      "claimed": "7 - total sulfur dioxide",
      "computed": "column 'total sulfur dioxide' is at 1-based position 7 (expected 7); dtype=float64"
    },
    {
      "quoted_span": "8 - density",
      "span_start": 1133,
      "span_end": 1144,
      "verdict": "holds",
      "claimed": "8 - density",
      "computed": "column 'density' at 1-based position 8 (expected 8), dtype=float64, non-numeric cells=0, nulls=0, min=0.99007, max=1.00369"
    },
    {
      "quoted_span": "9 - pH",
      "span_start": 1150,
      "span_end": 1156,
      "verdict": "holds",
      "claimed": "9 - pH",
      "computed": "column 9 = 'pH'; 'pH' found at position 9 of 12 columns; dtype=float64; rows=1599; non-numeric/null pH cells=0"
    },
    {
      "quoted_span": "10 - sulphates",
      "span_start": 1162,
      "span_end": 1176,
      "verdict": "holds",
      "claimed": "10 - sulphates",
      "computed": "column 'sulphates' is at 1-indexed position 10 (stated 10); dtype=float64"
    },
    {
      "quoted_span": "11 - alcohol",
      "span_start": 1182,
      "span_end": 1194,
      "verdict": "holds",
      "claimed": "11 - alcohol",
      "computed": "column 11 = 'alcohol'; 'alcohol' at 1-based position 11"
    },
    {
      "quoted_span": "Output variable (based on sensory data):",
      "span_start": 1200,
      "span_end": 1240,
      "verdict": "unverifiable",
      "reason": "prose"
    },
    {
      "quoted_span": "12 - quality",
      "span_start": 1246,
      "span_end": 1258,
      "verdict": "holds",
      "claimed": "12 - quality",
      "computed": "column 'quality' is at 1-based position 12 of 12 columns (claim: position 12)"
    },
    {
      "quoted_span": "12 - quality (score between 0 and 10)",
      "span_start": 1246,
      "span_end": 1283,
      "verdict": "holds",
      "claimed": "12 - quality (score between 0 and 10)",
      "computed": "min=3, max=8, out-of-[0,10]=0, non-numeric=0"
    },
    {
      "quoted_span": "Without doing any kind of feature engineering or overfitting you should be able to get an AUC of .88 (without even using random forest algorithm)",
      "span_start": 1675,
      "span_end": 1820,
      "verdict": "unverifiable",
      "reason": "prose"
    },
    {
      "quoted_span": "to turn the 10 point scale to dichtome variable",
      "span_start": 2023,
      "span_end": 2070,
      "verdict": "violated",
      "claimed": "to turn the 10 point scale to dichtome variable",
      "computed": "quality has 6 distinct levels: [3, 4, 5, 6, 7, 8] (min=3, max=8); stated scale = 10 points",
      "evidence_rows": [
        {
          "quality": "3",
          "n_rows": "10"
        },
        {
          "quality": "4",
          "n_rows": "53"
        },
        {
          "quality": "5",
          "n_rows": "681"
        },
        {
          "quality": "6",
          "n_rows": "638"
        },
        {
          "quality": "7",
          "n_rows": "199"
        }
      ]
    },
    {
      "quoted_span": "I am not the owner of this dataset.",
      "span_start": 3287,
      "span_end": 3322,
      "verdict": "unverifiable",
      "reason": "prose"
    },
    {
      "quoted_span": "Please include this citation if you plan to use this database",
      "span_start": 3327,
      "span_end": 3388,
      "verdict": "unverifiable",
      "reason": "prose"
    },
    {
      "quoted_span": "P. Cortez, A. Cerdeira, F. Almeida, T. Matos and J. Reis. Modeling wine preferences by data mining from physicochemical properties. ",
      "span_start": 3613,
      "span_end": 3745,
      "verdict": "unverifiable",
      "reason": "prose"
    }
  ],
  "usage": {
    "input_tokens": 2,
    "output_tokens": 3682
  },
  "wall_s": 111.09
}
