{
  "case_id": "web_red_wine_quality_cortez__891a10",
  "system": "baseline",
  "model_id": "claude-opus-5",
  "claims": [
    {
      "quoted_span": "The two datasets are related to red and white variants of the Portuguese \"Vinho Verde\" wine.",
      "span_start": 13,
      "span_end": 105,
      "verdict": "violated",
      "claimed": "Two datasets, one for red wine and one for white wine",
      "computed": "Information describes a single data file with 12 columns and no wine-type/variant column; the 50 sample rows match the red-wine variant only"
    },
    {
      "quoted_span": "For more details, consult the reference [Cortez et al., 2009].",
      "span_start": 106,
      "span_end": 168,
      "verdict": "unverifiable",
      "reason": "prose"
    },
    {
      "quoted_span": "Due to privacy and logistic issues, only physicochemical (inputs) and sensory (the output) variables are available (e.g. there is no data about grape types, wine brand, wine selling price, etc.).",
      "span_start": 169,
      "span_end": 364,
      "verdict": "holds",
      "claimed": "Only physicochemical inputs and one sensory output; no grape type, brand, or price fields",
      "computed": "12 columns: 11 physicochemical measurements plus quality; no grape type, brand, or price column present"
    },
    {
      "quoted_span": "These datasets can be viewed as classification or regression tasks.",
      "span_start": 367,
      "span_end": 434,
      "verdict": "unverifiable",
      "reason": "prose"
    },
    {
      "quoted_span": "The classes are ordered and not balanced (e.g. there are much more normal wines than excellent or poor ones).",
      "span_start": 435,
      "span_end": 544,
      "verdict": "holds",
      "claimed": "Ordered, imbalanced quality classes with mid-range scores dominating",
      "computed": "quality is int64 (orderable); in the 50 visible rows quality=5 occurs ~30 times vs 4 rows each at quality 4 and 7, so mid-range dominates"
    },
    {
      "quoted_span": "This dataset is also available from the UCI machine learning repository, https://archive.ics.uci.edu/ml/datasets/wine+quality , I just shared it to kaggle for convenience.",
      "span_start": 552,
      "span_end": 723,
      "verdict": "unverifiable",
      "reason": "prose"
    },
    {
      "quoted_span": "Input variables (based on physicochemical tests):",
      "span_start": 906,
      "span_end": 955,
      "verdict": "unverifiable",
      "reason": "prose"
    },
    {
      "quoted_span": "1 - fixed acidity",
      "span_start": 960,
      "span_end": 977,
      "verdict": "holds",
      "claimed": "Input variable 1 is 'fixed acidity'",
      "computed": "Column 1 is 'fixed acidity', float64"
    },
    {
      "quoted_span": "2 - volatile acidity",
      "span_start": 983,
      "span_end": 1003,
      "verdict": "holds",
      "claimed": "Input variable 2 is 'volatile acidity'",
      "computed": "Column 2 is 'volatile acidity', float64"
    },
    {
      "quoted_span": "3 - citric acid",
      "span_start": 1009,
      "span_end": 1024,
      "verdict": "holds",
      "claimed": "Input variable 3 is 'citric acid'",
      "computed": "Column 3 is 'citric acid', float64"
    },
    {
      "quoted_span": "4 - residual sugar",
      "span_start": 1030,
      "span_end": 1048,
      "verdict": "holds",
      "claimed": "Input variable 4 is 'residual sugar'",
      "computed": "Column 4 is 'residual sugar', float64"
    },
    {
      "quoted_span": "5 - chlorides",
      "span_start": 1054,
      "span_end": 1067,
      "verdict": "holds",
      "claimed": "Input variable 5 is 'chlorides'",
      "computed": "Column 5 is 'chlorides', float64"
    },
    {
      "quoted_span": "6 - free sulfur dioxide",
      "span_start": 1073,
      "span_end": 1096,
      "verdict": "holds",
      "claimed": "Input variable 6 is 'free sulfur dioxide'",
      "computed": "Column 6 is 'free sulfur dioxide', float64"
    },
    {
      "quoted_span": "7 - total sulfur dioxide",
      "span_start": 1103,
      "span_end": 1127,
      "verdict": "holds",
      "claimed": "Input variable 7 is 'total sulfur dioxide'",
      "computed": "Column 7 is 'total sulfur dioxide', float64"
    },
    {
      "quoted_span": "8 - density",
      "span_start": 1133,
      "span_end": 1144,
      "verdict": "holds",
      "claimed": "Input variable 8 is 'density'",
      "computed": "Column 8 is 'density', float64"
    },
    {
      "quoted_span": "9 - pH",
      "span_start": 1150,
      "span_end": 1156,
      "verdict": "holds",
      "claimed": "Input variable 9 is 'pH'",
      "computed": "Column 9 is 'pH', float64"
    },
    {
      "quoted_span": "10 - sulphates",
      "span_start": 1162,
      "span_end": 1176,
      "verdict": "holds",
      "claimed": "Input variable 10 is 'sulphates'",
      "computed": "Column 10 is 'sulphates', float64"
    },
    {
      "quoted_span": "11 - alcohol",
      "span_start": 1182,
      "span_end": 1194,
      "verdict": "holds",
      "claimed": "Input variable 11 is 'alcohol'",
      "computed": "Column 11 is 'alcohol', float64"
    },
    {
      "quoted_span": "Output variable (based on sensory data):",
      "span_start": 1200,
      "span_end": 1240,
      "verdict": "unverifiable",
      "reason": "prose"
    },
    {
      "quoted_span": "12 - quality (score between 0 and 10)",
      "span_start": 1246,
      "span_end": 1283,
      "verdict": "holds",
      "claimed": "Column 12 is 'quality', a score between 0 and 10",
      "computed": "Column 12 is 'quality', int64; observed values in the 50 visible rows are 4, 5, 6, 7, all inside 0-10"
    },
    {
      "quoted_span": "set an arbitrary cutoff for your dependent variable (wine quality) at e.g. 7 or higher getting classified as 'good/1' and the remainder as 'not good/0'.",
      "span_start": 1389,
      "span_end": 1541,
      "verdict": "unverifiable",
      "reason": "prose"
    },
    {
      "quoted_span": "This allows you to practice with hyper parameter tuning on e.g. decision tree algorithms looking at the ROC curve and the AUC value.",
      "span_start": 1542,
      "span_end": 1674,
      "verdict": "unverifiable",
      "reason": "prose"
    },
    {
      "quoted_span": "Without doing any kind of feature engineering or overfitting you should be able to get an AUC of .88 (without even using random forest algorithm)",
      "span_start": 1675,
      "span_end": 1820,
      "verdict": "unverifiable",
      "reason": "prose"
    },
    {
      "quoted_span": "**KNIME** is a great tool (GUI) that can be used for this.",
      "span_start": 1822,
      "span_end": 1880,
      "verdict": "unverifiable",
      "reason": "prose"
    },
    {
      "quoted_span": "File Reader (for csv) to linear correlation node and to interactive histogram for basic EDA.",
      "span_start": 1889,
      "span_end": 1981,
      "verdict": "unverifiable",
      "reason": "prose"
    },
    {
      "quoted_span": "File Reader to 'Rule Engine Node' to turn the 10 point scale to dichtome variable (good wine and rest)",
      "span_start": 1989,
      "span_end": 2091,
      "verdict": "unverifiable",
      "reason": "prose"
    },
    {
      "quoted_span": "**$quality$ > 6.5 => \"good\"**",
      "span_start": 2160,
      "span_end": 2189,
      "verdict": "holds",
      "claimed": "A column named 'quality' exists and can be thresholded numerically",
      "computed": "Column 'quality' present with int64 numeric values (4-7 in the sample), so a >6.5 rule is applicable"
    },
    {
      "quoted_span": "Column Filter node to filter out your original 10point feature (this prevent leaking)",
      "span_start": 2260,
      "span_end": 2345,
      "verdict": "unverifiable",
      "reason": "prose"
    },
    {
      "quoted_span": "Partitioning Node (your standard train/tes split, e.g. 75%/25%, choose 'random' or 'stratified')",
      "span_start": 2391,
      "span_end": 2487,
      "verdict": "unverifiable",
      "reason": "prose"
    },
    {
      "quoted_span": "Use machine learning to determine which physiochemical properties make a wine 'good'!",
      "span_start": 2891,
      "span_end": 2976,
      "verdict": "unverifiable",
      "reason": "prose"
    },
    {
      "quoted_span": "I am not the owner of this dataset.",
      "span_start": 3287,
      "span_end": 3322,
      "verdict": "unverifiable",
      "reason": "prose"
    },
    {
      "quoted_span": "Please include this citation if you plan to use this database:",
      "span_start": 3327,
      "span_end": 3389,
      "verdict": "unverifiable",
      "reason": "prose"
    },
    {
      "quoted_span": "In Decision Support Systems, Elsevier, 47(4):547-553, 2009.",
      "span_start": 3524,
      "span_end": 3583,
      "verdict": "unverifiable",
      "reason": "prose"
    }
  ],
  "usage": {
    "input_tokens": 2,
    "output_tokens": 7248
  },
  "wall_s": 83.49
}
